{
  "schema_version": "0.1.0",
  "entity_id": "host:demo/nic:1",
  "field": "network.rx_total",
  "value": {
    "kind": "uint64",
    "data": "18446744073709551615"
  },
  "unit": "byte",
  "origin": "observed",
  "support": "supported",
  "acquisition": "success",
  "freshness": "current",
  "presence": "present",
  "source_id": "source:synthetic",
  "observed_at": "2026-09-17T12:00:00+10:00",
  "attempted_at": "2026-09-17T12:00:00+10:00",
  "producer_epoch": "fixture:epoch-1",
  "generation": "1",
  "sample_interval_ns": null,
  "error": null
}
